{
  "schemaVersion": "1.0",
  "receiptId": "5250f40d-9452-4524-9dd9-cc1534c5d442",
  "runId": "cefeaa20-28e3-474b-8f21-30d40af6e02d",
  "candidateId": null,
  "skill": {
    "name": "rpa-build",
    "version": "1.0"
  },
  "capability": "RPA-BUILD",
  "intentId": null,
  "status": "succeeded",
  "stage": "execute",
  "actor": {
    "kind": "codex",
    "host": "chacada"
  },
  "context": {
    "completedAt": "2026-09-20T16:35:52Z",
    "designReceipt": "dacea107-8543-437f-971b-2b8fd3ceec0e"
  },
  "input": {
    "repository": "/mnt/c/Users/woo/woo/00_project/05_GMBKOREA/RPA/판매관리팀/FTA원산지",
    "branch": "feat/t7-u6-u9-common",
    "sourceRevision": "1b7a79ba57fb144be3c517c64d587f6e4f9fe16d",
    "processId": "FTA원산지:p1",
    "scope": "p1.t3 C/NO 탐색 사다리의 명명 행과 FTA 전체 안전 회귀"
  },
  "decision": {
    "pattern": "탐색 범위·정규식·판정 방법을 CnoCase의 명명된 세 열로 두고 엄격→느슨 순서대로 반복 처리",
    "behaviorChange": false,
    "identityChange": false,
    "testBoundary": "재수출 패키지가 아니라 실제 구현 또는 호출 시점 조회 모듈을 monkeypatch 대상으로 사용"
  },
  "validation": [
    {
      "check": "python syntax",
      "status": "passed",
      "detail": "Windows Python 3.14 py_compile 통과"
    },
    {
      "check": "invoice and pipeline regression",
      "status": "passed",
      "detail": "인보이스 특성화·파이프라인·송품장 행 테스트 48개 통과"
    },
    {
      "check": "positional matrix audit",
      "status": "passed",
      "detail": "FTA 비테스트 Python 파일에서 2행 이상·3열 이상 위치 튜플 행렬 후보 0건"
    },
    {
      "check": "full FTA regression",
      "status": "passed",
      "detail": "FTA tests 전체 441개 통과, 기존 _02_extract_co DeprecationWarning 5건"
    },
    {
      "check": "placeholder scan",
      "status": "passed",
      "detail": "관련 구현·테스트 파일에서 TODO·FIXME·skip·only 없음"
    }
  ],
  "authorization": {
    "source": "user",
    "scope": "Helix QAC와 FTA 코드를 구조 변경 포함 행렬형 가독성으로 정제"
  },
  "execution": {
    "writes": [
      "/mnt/c/Users/woo/woo/00_project/05_GMBKOREA/RPA/판매관리팀/FTA원산지/task/_03_extract_invoice/task.py",
      "/mnt/c/Users/woo/woo/00_project/05_GMBKOREA/RPA/판매관리팀/FTA원산지/tests/test_invoice_characterization.py",
      "/mnt/c/Users/woo/woo/00_project/05_GMBKOREA/RPA/판매관리팀/FTA원산지/tests/test_pipeline_wiring.py",
      "/mnt/c/Users/woo/woo/00_project/05_GMBKOREA/RPA/판매관리팀/FTA원산지/tests/test_screen_reset.py",
      "/mnt/c/Users/woo/woo/00_project/05_GMBKOREA/RPA/판매관리팀/FTA원산지/tests/test_secret_resolution.py",
      "/mnt/c/Users/woo/woo/00_project/05_GMBKOREA/RPA/판매관리팀/FTA원산지/tests/test_mail_report.py"
    ],
    "externalActions": [],
    "externalSystemsInvoked": false
  },
  "result": {
    "changed": [
      "CNO_CASES의 위치 튜플을 CnoCase(scope, pattern, method) 불변 행으로 교체",
      "탐색 소비부와 특성화 테스트가 명명된 열을 직접 사용",
      "FTA 테스트의 재수출 import 경계를 실제 구현·조회 표면으로 통일",
      "계측 제목 테스트를 rpa-map 정본 Unit 이름 u1.open과 일치시킴"
    ],
    "outputSha256": {
      "task/_03_extract_invoice/task.py": "c5fe4c3d5381de193175fd7e0c2c1ad4b6a893373d067e641ae38435931fc879",
      "tests/test_invoice_characterization.py": "d9ecb7518e81f9aaa946e550a3a888d2bab544231f0d7642d3bc7d1224771243",
      "tests/test_pipeline_wiring.py": "5e34a89e825e29c9e002b64a33f8722c32505ab9b949f9bb0ac559b008bd4302",
      "tests/test_screen_reset.py": "47e49426ed642f4fb2c0c9ad44531fbad87e0e04cdb5154e2a8fc23b87775d64",
      "tests/test_secret_resolution.py": "da152d75a6118f186dfada30ecce0c2259b818917428daa78bafde3a6d493bf8",
      "tests/test_mail_report.py": "ec2a8260a9ba06b519ece4d439aa83188bfd055b73b6121550a2d6d62c696e0f"
    },
    "resolvedPreexisting": "재수출 monkeypatch 실패 17건과 rpa-map Unit 이름 기대 불일치 2건을 교정해 전체 suite 녹색",
    "nextSlice": "Helix·FTA 구조 감사 결과 종합과 독립 검토 준비"
  },
  "failure": null,
  "evidence": [
    {
      "command": "C:\\Python314\\python.exe -m pytest -q tests/test_invoice_characterization.py tests/test_pipeline_wiring.py tests/test_common_invoice_row.py",
      "result": "48 passed in 0.44s"
    },
    {
      "command": "C:\\Python314\\python.exe -m pytest -q tests",
      "result": "441 passed, 5 warnings in 12.31s"
    }
  ],
  "nextCapabilities": [
    "RPA-TEST",
    "RPA-SAFETY"
  ],
  "receiptDigest": "f6f6077bd01f4bc1e98486ec8eef071a886e18f9da11945bf28c2d40e4ace147"
}
